,listing_id,id,date,reviewer_id,reviewer_name,comments,Year
732020,22215734,701486518032212976,2022-08-25,26832375,Christian,Very convenient place to stay near the airport and not that far from the city.<br/>Comunication pretty accurate and easy check in.,2022.0
732027,22215734,702268021308145038,2022-08-26,23392121,María,Todo estuvo perfecto. El baño amplio y limpio. Había bebidas complementarias. Isaac estuvo pendiente todo el tiempo de lo que necesitara.,2022.0
732028,22215734,705840463567842657,2022-08-31,18871852,Elke,Isaac’s suite was perfect. The space was clean and modern.  The sheets are a high thread count and the bed is so comfortable. <br/>It’s a mile from the airport. <br/>We had complementary beverages and such wonderful hospitality.  Would highly recommend!,2022.0
732029,22215734,706579864635599098,2022-09-01,220865380,April,"Wonderful accommodations, very good location and very clean and well maintained! Would definitely stay again!",2022.0
732030,22215734,708769370624267815,2022-09-04,458688774,Johnpaul,Great spot  to stay if you're gonna visit LA. I'd give them 6 stars if I could!,2022.0
732031,22215734,710238401468878095,2022-09-06,51259744,Allex,The suite appear to be new and it's very clean and comfortable. The host provided easy check in instructions. There was plenty of water and coffee available for me during my stay...I'd definitely stay there again.,2022.0
732032,22215734,713129542240911106,2022-09-10,111383585,Christopher,Great location! close to the airport and other LA hotspots! definitely recommend!,2022.0
732033,22215734,714528938443829279,2022-09-12,372573185,Gregory,"We stayed for one night after watching  the game at SOFI, we enjoyed the private quiet stay. Small studio but that’s what they advertise. Overall great stay and would stay again !",2022.0
732034,22215734,716724566468009045,2022-09-15,370113536,Jon,Beautiful room. Excellent communication. Attention to detail.,2022.0
732035,22215734,717430669291924321,2022-09-16,375189394,Michael,Amazing place and Wonderful hosts! Would definitely book again next time I visit!,2022.0
732036,22215734,718897524317694851,2022-09-18,13457737,Taising,"Great place to stay for a short trip to LA and when you have an early flight to catch. The place was extremely clean, comfortable bed, and thoughtful amenities. Isaac and Tianna were also great with communication.",2022.0
732037,22215734,720383131119744362,2022-09-20,20754107,Nicholas,"Great stay. Looked new/modern. Very clean, comfortable, and plenty of room to leave all of your luggage wide open. Loved the workstation (wifi was fast). Quiet neighborhood, didn't hear the planes from LAX all that much (and I'm the type of person that is very sensitive to noise). Enjoyed the complimentary drinks and water pitcher in the fridge (lifesaver). Host was very responsive. Priced well. I didn't use the big TV as I was tired but that is a nice touch. I don't have any complaints.",2022.0
732038,22215734,721127487400108665,2022-09-21,33512834,Michael,Great Airbnb! I had a overnight layover in LA and booked here and so glad I did. The place was super clean and the self check in was easy. Fantastic space,2022.0
732039,22215734,722544350661854115,2022-09-23,329031767,Lea,The suite was nice and clean. The host was really helpful. The neighborhood was pretty and quiet.,2022.0
732042,22215734,723250784906069289,2022-09-24,332182407,Peter,"A great location in a quiet almost secluded neighborhood, yet close to so much. The room shows thoughtful planning and great ammenities to make sure guests are comfortable. Will definetly stay again when we are in LA.",2022.0
732043,22215734,724037512794529893,2022-09-25,143967576,Ernestina,We were very comfortable here:),2022.0
732044,22215734,724712374078889896,2022-09-26,83610882,Laura,"My husband, 2 dogs, and I loved our stay! So comfortable and peaceful - we couldn’t have asked for a better place to stay. Thank you Isaac!",2022.0
732045,22215734,725457429428320961,2022-09-27,164711139,Vanessa,"We absolutely loved our stay and wish we stayed longer! It’s quite close LAX. Everything looked clean, bed was so comfortable and communication was great. Thank you so much for the stay and hospitality. We hope to come back again!",2022.0
732046,22215734,726110863255307883,2022-09-28,141582339,Juan Miguel,"excelente estadía en casa de isaac, todo fue genial.",2022.0
732047,22215734,729734952917869114,2022-10-03,289488690,Hank,"Great place, clean and comfortable, easy check in, super helpful hosts.",2022.0
732048,22215734,730460051941505830,2022-10-04,1870969,Munyema,"Comfortable, clean and everything was fully streamlined. Will stay again!",2022.0
732049,22215734,733389225790196344,2022-10-08,384279364,Dany,The place looks good for the price you pay.  I just needed a place overnight between trips but it’s not suitable for long term.,2022.0
732050,22215734,734140473698789699,2022-10-09,126524081,Rachel,Isaac’s place was super comfy and clean. Great host and easy check in. Super close to LAX airport. Was perfect for a one night lay over. Will definitely stay again.,2022.0
732051,22215734,734823129907380423,2022-10-10,357866100,Monica,"Perfect stay for my husband and I! Isaac and Tianna were very accommodating hosts and their customer service was exceptional! The room was clean, check-in was easy, and the unit was in a great location. Overall, great experience.",2022.0
732053,22215734,736303819942191813,2022-10-12,151688637,Kristina,"Everything was perfect.<br/>Place was clean and everything I needed was available. Bed was super comfortable and the porch great for those who would like to have their morning coffee on clean air. My stay was comfortable, I definitely would visit again.",2022.0
732054,22215734,737026651703763150,2022-10-13,370495576,Sultan,Great place to stay! Issac and Tianna were excellent hosts.,2022.0
732055,22215734,739231909203705772,2022-10-16,375150921,Erica,"Great location, felt very safe, very clean and kept up.",2022.0
732056,22215734,741442093662706561,2022-10-19,147261290,Tiara,"Isaac's place was very nice and accomodating!  It was definitely a small space with just bedroom and bathroom, but it was still spatious!  The  check in instructions were easy to follow to get into the place.  Parking was perfect, we got a spot on the street maybe two cars away from the house, so not far at all to walk.  It's on the end of a quiet cul-de-sac so you wont get too much city noise and its very close by to the inner city.  We drove less than 20min to Venice Beach after checking out, so it is pretty close by to lots of things.  I would definitely stay here again",2022.0
732057,22215734,742056557327097016,2022-10-20,184097309,Rachel,"This is a GREAT AirBnB close to the airport! The hosts were extremely kind and attentive, providing detailed and clear instructions on how to find the AirBnb and how to check in and check out. The AirBnb was really clean as well and the host provided complementary drinks in the fridge, which was much appreciated. I finished the water I had brought with me, and it was nice to have a water bottle from the fridge that I could drink without having to run out to get one. Would definitely stay here again! :)",2022.0
732058,22215734,744284082528387343,2022-10-23,257251562,Jackie,"Nice clean apartment room with patio space.  Appears to have been recently remodeled.  Comfy bed.  Large TV.  Coffee, waters small fridge. Pet friendly.  It was perfect for our one night quick pass through LA.<br/>If you need a one night stay coming or going from LAX, location is perfect.  Close to airport, but no plane noise. Quiet cul de sac in a nice neighborhood.",2022.0
732059,22215734,744993429149339583,2022-10-24,84808432,Alexander,"Great attention to detail and hospitality provided by Isaac. Ensured the guests had the support they needed in case of any questions. Everything was up to standards and enjoyed the stay here, convenient location next to LAX airport.",2022.0
732060,22215734,745728612824479374,2022-10-25,52722079,Anna,"LA is not easy to find accommodations that is not only safe, reliable and convenient. Traffic is a beast and this place was an oasis for us. We had no worries from safe neighborhood, parking, amenities, comfortable bed and room as well as safety. There were extras that were unexpected but made our layover so much more comfortable. Both Isaac and Tianna were amazing to communicate with and we look forward to returning at some point. <br/>Seriously any time this place is available, book with confidence that you will be safe, taken care of and bonus very close to LAX. <br/>Thanks guys for a lovely stay!",2022.0
732061,22215734,747956562918595869,2022-10-28,298323,Wilson,"The space is perfectly situated. There is a microwave, coffee machine and waters in the fridge. The bathroom is large and the Airbnb has everything needed. Isaac was very communicative and helpful with his check ins. One thing to note is that you can hear the people upstairs. Was not a major issue though.",2022.0
732062,22215734,749388852337511060,2022-10-30,228019923,Alyssa,I had a wonderful time and I highly recommend this spot.,2022.0
732063,22215734,750748107310205695,2022-11-01,339753876,Anisa,"This space was very nice and cozy. The hosts were very helpful throughout my stay, and they continued to check up on me to see if I needed anything. Check in and check out was very easy, and I would definitely recommend this space to anyone that’s staying in LA for a few days.",2022.0
732064,22215734,754442483962077180,2022-11-06,28417820,Sondra,This place was great! The host was so nice and attentive. The location was central to lots of things in the greater LA area and so close to the airport.,2022.0
732065,22215734,755153441997100534,2022-11-07,476923393,Ana,"Ótimo quarto, localização tranquila, muito limpo e confortável. Recomendo muito! Obrigada",2022.0
732067,22215734,755934028367613805,2022-11-08,98201862,Kandie,"My stay was great. The unit was clean and exactly as described. If I am ever in the area, I would stay here again.",2022.0
732068,22215734,757368528220425355,2022-11-10,197133180,Yesenia,"Came into town for a concert at the Forum and this place is perfect! About a 15ish minute ride to the venue, like 5 minutes to/from the airport, it really is the perfect spot if you’re coming in for a quick trip! <br/>It was so clean and came with some essentials that sometimes you can forget which was amazing! Comfy bed, quiet at night, the hosts were so kind and accommodating. 100% would recommend",2022.0
732069,22215734,758069373907627766,2022-11-11,196234306,Raxce,The place was great! No issue with street parking right in front of the unit.<br/>Very clean and matches the pictures in the listing. Quiet neighborhood and hosts helped with any questions the whole time!<br/>Plus it’s near LAX! Definitely recommended!,2022.0
732070,22215734,758833666005836431,2022-11-12,115966215,Moniqua,"Great stay, quiet Westchester neighborhood quick drive to Playa Vista, Mar Vista and Culver City.",2022.0
732071,22215734,759499548401539599,2022-11-13,71484684,Adam,"The whole stay was fantastic! No complaints here, thanks for being a great host! :)",2022.0
732074,22215734,760965298057633829,2022-11-15,164728028,Bryan,Cozy but extremely well executed. The guest suite was extremely clean and had all the amenities we needed for a couple nights in town before flying back home. Street was very quite due to being in a cul-de-sac. Very impressed with the quality and value.,2022.0
732075,22215734,761731360058955505,2022-11-16,25503285,Stephanie,the place was great with easy entry and some appreciated waters stockedin the fridge. location was great for an early morning flight out of LAX.,2022.0
732076,22215734,763204266845611505,2022-11-18,349247760,Bridget,Great place to stay!,2022.0
732077,22215734,763908765878543666,2022-11-19,275795536,Joo Hyun,Very kind and responsive host with peaceful and well organized house,2022.0
732078,22215734,764600929426049637,2022-11-20,21383369,James,"Great stay.  It's actually a guest house on a private property.  Convenient to the airport and very secluded.  Hosts gave exacting instructions for entrance and check out with the option for late checkout if needed.  Had a great stay.  Place was clean and exactly as photographed/described.  Nice touches included free soft drinks, soap and shampoo.  Dog friendly!!!",2022.0
732079,22215734,768918415694772798,2022-11-26,205551767,Ethan,Clean and comfy place to stay. Location is convenient to downtown and the beaches. Great place for travelers with pets - our doggo especially enjoyed the private yard. We love the sliding door which let in a lot of sunlight. Definitely would come back.,2022.0
732100,22215734,770385296521898616,2022-11-28,5488419,Robyn,"This was a great spot, peaceful and clean.<br/> Good amenities and responsive host",2022.0
732108,22215734,774089428670861220,2022-12-03,362071379,Sally,100% recommend Issac and Tiana’s place. Super close to LAX which is a bonus and they are wonderful hosts. They were very flexible and accommodating and was willing to help out in anyway they could.,2022.0
732112,22215734,774789837814585637,2022-12-04,219190138,Isa,"we only stayed one night after a flight from Japan, the location was excellent and the room was clean, private and big :) the owners even had a fridge with amenities that we appreciate very mucho. Thank you! check in and check out was very easy",2022.0
732120,22215734,775425706320988883,2022-12-05,64237070,Rachel,"Incredibly convenient location for the airport. Very clean, easy to get into, and a lock on both the gate and the door making it feel safe and secure. Cozy and comfortable and made catching our 7am flight seamless!",2022.0
732121,22215734,776237124429390819,2022-12-06,179771165,Tatiana,My stay was lovely I cleansed myself . It was peaceful and quiet I slept so good.,2022.0
732122,22215734,778328765489474929,2022-12-09,251875377,Gayn,"Needed a convenient place to stay before an early flight and this place was perfect. bed was comfy, everything was spotless and the drinks provided were a nice touch! will say though that we had to take cold showers but everything else was 10/10.",2022.0
732123,22215734,780530127422022151,2022-12-12,114583998,Nick,Our stay was short but great. Had everything we needed to feel at home. Very close to the airport which made it a breeze when leaving.,2022.0
732124,22215734,781985142344985460,2022-12-14,150733647,Arielle,Perfect for a short stay! Isaac's place has everything you could need packed in a perfectly sized place.,2022.0
732125,22215734,784160813211222123,2022-12-17,194102286,Ted,"Great place to stay very close to LAX. Some noise from the condo attached to us l, but it wasn’t bad. Had a very comfortable memory foam mattress….Would stay again!",2022.0
732126,22215734,784932524023738129,2022-12-18,226619020,Felix,"Absolutely loved this guest suite. Description is accurate, location is great, and neighborhood is wonderful. The guest suite was extremely clean and the bed was comfortable to sleep on. I would definitely stay here again and would highly recommend it to everyone else.",2022.0
732127,22215734,785678150710506046,2022-12-19,6297604,Joel,Awesome place!!! Much thanks to you Isaac!!!!!!,2022.0
732128,22215734,793595843840472633,2022-12-30,41871816,Prerna,"Great cozy place, very close to the airport. We stayed there with our pup for a few days and found the place and neighborhood very accommodating. The place had everything we needed and check-in, check-out was hassle free! Would recommend this cozy place.",2022.0
732129,22215734,795069953537340141,2023-01-01,145162159,Natasha,"This place was super cute, the bed was really comfortable and perfect proximity to the airport!",2023.0
732130,22215734,797181440254076667,2023-01-04,464506919,Shania,"the place looked better than pictures. it was spacious, clean and well stocked. will book again, one of the best airbnb finds!",2023.0
732131,22215734,797992840106574441,2023-01-05,489378989,Mi2casa,Super close to airport!  The spot clean & comfortable! Highly recommend! !,2023.0
732132,22215734,798653818341686233,2023-01-06,110624159,Jennifer,Super helpful and responsive hosts. Nice and clean. Would definitely stay here again!,2023.0
732133,22215734,799356109758657899,2023-01-07,357248303,Aric,actually legit.,2023.0
732134,22215734,800087821541757425,2023-01-08,317488357,Miguel,"Esta súper cerca de aeropuerto de Los Ángeles, la casa es limpia, cómoda tiene todo lo que uno necesita.<br/>Lo único malo fue el ruido de otra habitación como que se escucha murmullos pero todo bien aparte de eso",2023.0
732135,22215734,801567280881354261,2023-01-10,191947167,Carlee,9,2023.0
732136,22215734,803034109803789848,2023-01-12,19903985,Eric,"Isaac's place was just as described. It was easy to find, easy to check in and he was extremely clear on check in instructions and how to access the place. The bed was comfortable, the drinks (coffee) were an added bonus, and the private room was exactly as I expected. I would definitely stay again and recommend booking if you're looking for a great, affordable place to stay near LAX.",2023.0
732137,22215734,805138437053994557,2023-01-15,494227616,Marianna,"Stayed overnight at this cozy spot - extremely easy to get in and out of, very comfortable and clean. Didn't really need to communicate with the hosts much since everything was already set up and explained well. Had a great stay, thank you!",2023.0
732145,22215734,805971881406315721,2023-01-16,316810434,Mitch,"Very clean, very comfortable, very quiet. Isaac puts thought into the little details like giving clear instructions and making sure that the space is inviting. If you’re looking for a small place in West LA or close to the airport I couldn’t recommend this one enough.",2023.0
732146,22215734,808759851368117499,2023-01-20,106751753,Sakul,Isaac and Tianna clearly put in a lot of effort to make sure the room was as cozy and comfortable as possible. I would definitely stay here again,2023.0
732147,22215734,809512371709958181,2023-01-21,190033050,Brandon,A wonderful stay in a surprisingly quiet neighborhood.,2023.0
732148,22215734,810228675954088444,2023-01-22,134729880,James,"Perfect location for a night before a flight out of LAX. Room was very clean and nice bathroom, definitely a better place to stay than a similarly priced hotel room!",2023.0
732149,22215734,810943253996435655,2023-01-23,496395613,Daniel,great stay,2023.0
732150,22215734,812405390935486871,2023-01-25,104216058,Maurits,Heerlijk verblijf dicht bij restaurants en luchthaven. <br/>Is zeker je geld waard.<br/>Fantastische hoost die altijd reageert op een vraag en we komen later uit checken wat zeer wenselijk was.<br/>Top top top.,2023.0
732151,22215734,813879647602978807,2023-01-27,364285492,Lisette,"We had a concert over at The Forum and this place was perfect!! Only a short drive to our destination, extremely clean and immensely comfortable. I cannot express how much we loved staying here, and we would most definitely do it again!",2023.0
732152,22215734,817456853753408500,2023-02-01,409474882,Louisa,"Great place to stay before a flight, very comfortable and clean!",2023.0
732153,22215734,818202396572154906,2023-02-02,192191864,RayNetta,"Absolutely an amazing stay. It was a quiet and Beautiful neighborhood, and  me and my doggy felt perfectly at home. I enjoyed the stocked fridge and the cleanliness of the Airbnb. I would recommend this to anyone, definitely a five star stay.",2023.0
732154,22215734,818960858594104808,2023-02-03,416373813,Davide,Quartiere tranquillo e allloggio pulito !,2023.0
732155,22215734,820439701480947916,2023-02-05,51069808,Danielle,"We enjoyed our stay here! The place is in a quiet neighborhood that is in a very convenient location. The host was kind and responsive. The room was private, clean,  cute, and had everything we needed. We would certainly stay again.",2023.0
732156,22215734,821129413917219477,2023-02-06,421797668,Janisha,Great stay & nice location!,2023.0
732170,22215734,823339080683469661,2023-02-09,107835852,Malik,Never had any issues with Issac’s listings. Great host. Clean and neat stay.,2023.0
732231,22215734,824774044093652925,2023-02-11,365190657,Caleb,Great comfy place to stay.,2023.0
732257,22215734,825431077386459950,2023-02-12,20363917,Moses,This listing is perfectly located and got everything needed. Private entry and safe neighborhood with plenty of parking. Comfy bed and sparkly clean.,2023.0
732258,22215734,826904101064656653,2023-02-14,120273306,Tramaine,I absolutely love this spot.I  just wish it could have been rented for monthly or longer term for Medical travelers. Other then that I will definitely stay here again.,2023.0
732259,22215734,827626863182655244,2023-02-15,177197074,Nnamdi,It’s rare that I write reviews but Isaac is amazing and the place is in a quite and nice neighborhood in Westchester.,2023.0
732260,22215734,830511812570427518,2023-02-19,196374772,Stephanie,"Super cute air bnb. With only one complaint, I didn’t feel like the shower got hot enough. But that’s just my opinion 🤷🏻‍♀️ <br/>Other then that felt very private and easy to access with food and things to do near by.",2023.0
732261,22215734,831345536763667069,2023-02-20,425658454,Nelson,"Very clean and comfortable Airbnb, and very detailed and clear communication and instructions from the hosts. Location made getting to LAX for a morning flight incredibly easy. I would stay there again.",2023.0
732262,22215734,831991163666910663,2023-02-21,55394014,Marlo,great host. guest suite was clean and neighbourhood felt very safe and private . would stay again,2023.0
732263,22215734,833449042873514640,2023-02-23,276102678,Walker,"Very clean, comfortable bed, felt safe parking my car on the street.",2023.0
732264,22215734,835615466387259675,2023-02-26,470758009,Kimberley,"Great place to stay, totally would come back! Very clean, comfy, and warm! They always checked in and made sure I had everything, Loved it!",2023.0
732265,22215734,837047957774909032,2023-02-28,22784202,Fred,A good place to stay with self sufficient private entry.,2023.0
732266,22215734,838542738308656947,2023-03-02,41506154,Amira,Great communication and super comfortable bed.,2023.0
732267,22215734,843564184969316992,2023-03-09,99301516,Kristina,The room is close to the airport and the host is excellent. Highly recommend.,2023.0
732268,22215734,849349572598554330,2023-03-17,51241701,Hanna,"Stay was great! We were comfortable, our dog was happy as it wasn’t too loud, and hosts were extremely responsive and available. Thank you!",2023.0
732269,22215734,850820151005086271,2023-03-19,45676577,Christine,We had a lovely stay in this home with our pup. The room was very comfortable and easy to find. The host responds to messages quickly and clearly communicated how to arrive at the house. The neighborhood feels safe and walkable for our dog. While we did not actually fly into LA the distance from the airport is a plus. We strongly recommend staying here!,2023.0
732270,22215734,851528896727876840,2023-03-20,66481587,Grant,Thank you so much! Awesome place - perfect location near the airport!,2023.0
732271,22215734,853016677584690552,2023-03-22,155311051,Yisel,"After booking & day of stay, we received a message asking us to remove our shoes to keep the carpet clean upon arriving as an additional rule not provided in the listing description. The gate locked us out & stopped working once we entered so it had to be left propped open. Upon entering the room, there was rain water that had leaked in through the main door so I immediately messaged the host about it, especially due to their added rule on keeping the carpet clean. The sliding doors & the restroom were both open/unlocked when we arrived which caused me to feel a bit unsafe. No lotion was available. The room was extremely humid & I sweat through the night as a result. The biggest concern was that at almost 11pm, there was metal clanging & dragging, stomping, & loud talking behind & right above our heads (from where the bed was located).  I had to message the host in order to get him to take action on it. The room is definitely overpriced & needs better insulation.",2023.0
732272,22215734,855945628966700508,2023-03-26,296258108,Marnnelli,"The room was clean, cozy, quiet. Neighborhood was peaceful and we felt safe during our stay. Host was super responsive and gave clear instructions. Lots of free parking on the street near the house. Great place to stay if you have a flight to catch, 5 min drive to LAX. We stayed for 4 nights and had a commendable overall experience. This place is highly recommended.",2023.0
732273,22215734,857298786879892473,2023-03-28,21145890,Esteban,"Habitación que tiene todo lo necesario para una estadía corta luego de un vuelo largo.<br/>A 5 minutos del aeropuerto, en un barrio tranquilo. La habitación tiene gran aislación acústica, no se escuchaba el tráfico de la avenida de atrás de la casa.<br/>La habitación estaba súper limpia y contaba con todo lo básico, microondas, máquina de café, algunos escenciales para comer, baño equipado.",2023.0
732274,22215734,860193142618920919,2023-04-01,57763435,Danielle,I had a nice time at Isaac and Tianna's place. It felt very private and the location would be very convenient if you need to be near the airport. The space was clean and cozy. There were a few hiccups and they were great at communicating and addressing at issue that came up.,2023.0
732275,22215734,861738844373549657,2023-04-03,497458944,Victor,"The place was comfortable, clean, and cozy. Very good communication, clear instructions. Beautiful neighborhood. Really enjoyed my stay.",2023.0
