,listing_id,id,date,reviewer_id,reviewer_name,comments,Year
1049547,39471761,601131666,2020-02-02,262391679,Kiara,Was very welcoming great home would love to book again,2020.0
1049548,39471761,604320978,2020-02-10,124316832,Dustin,I would definitely book again,2020.0
1049549,39471761,605152916,2020-02-13,225500629,Jein,"It was the last night in LA, so I just considered the location and It was much better than I expected. <br/>Everything was perfect. If you need a place near the airport I highly recommend this house.",2020.0
1049550,39471761,605483984,2020-02-14,323543704,Terry,"Grant's home is definitely the one you want to stay if you are transiting at Los Angeles Airport. It is just a 5 to 10 minutes drive away and is close to all the car rental companies. This makes things very easy for us as we have a 9am flight to catch. The house is clean and with a huge TV rooted near the ceiling. This makes binge watching on the bed an amazing experience. The toilet facilities is simple awesome! I thought I step into a 6 star hotel with the huge bath tub and 3 basin in total. You have to see it in person to know what I mean. You have a guaranteed parking space house right in front of the garage as well. Overall, I enjoyed my stay and would recommend to anyone who wants to stay near LAX!",2020.0
1049551,39471761,606040616,2020-02-15,308534299,Sabrina,I loved my stay here! The bedroom and bathroom are huge. The bathtub is great for a bath after a stressful day. It’s super close to LAX so you don’t have to drive much if you’re just landing. The painting on the wall also gives it a very nice touch. Grant was very responsive and replied to my messages right away and was very welcoming.,2020.0
1049588,39471761,607379294,2020-02-17,122209226,Chris,Great place!!,2020.0
1049609,39471761,607823222,2020-02-18,238747363,Sylvana,It was a great place! <br/>And I would definitely stay there again !,2020.0
1049610,39471761,608488307,2020-02-20,28460733,Liz,Really nice and clean! Thoughtful touch with the coffee maker and drinks!,2020.0
1049612,39471761,608873214,2020-02-21,54439070,Dana,"Really nice space and very convenient. Took a minute to figure out the tv but it does work, connects to Netflix, Hulu, etc. Cool and affordable!",2020.0
1049619,39471761,609348493,2020-02-22,148711254,Jaryd,"Clean and Stylish! Grant is super helpful and reliable. Replies fast as well, great stay!",2020.0
1049620,39471761,610140803,2020-02-23,100058042,Derrik,"Beautiful and clean space. Bathroom is huge and very nice. Thought the space is very clearly a master bedroom, it really felt like you were staying in a hotel.",2020.0
1049621,39471761,611026342,2020-02-25,226761071,Renne,Amazing Place!!,2020.0
1049636,39471761,611392482,2020-02-26,269654954,Noa,Book this air B and B!!! Great location and quick communication,2020.0
1049643,39471761,611691482,2020-02-27,271197609,Sophia,"Loved the place, very clean and spacious. Would definitely stay here again!",2020.0
1049648,39471761,612077115,2020-02-28,122502633,Nicole,"Fantastic place, very spacious and sparkling clean. Has everything you could want for an overnight stay. Coffee and utensils, fridge with waters and those cute little shampoo and conditioners in the shower. Huge tub, and the TV is massive, but unobtrusive. Felt safe for a single female traveler. Grant was excellent in response time and friendly, provided great information as well. Driveway parking a huge plus. Would highly recommend!",2020.0
1049649,39471761,613753905,2020-03-02,243181742,Matt,"Hands down best Airbnb I’ve ever booked. Great location, clean, & super cozy. Perfect for a work trip or even a couples getaway. Definitely staying here next time I’m in Los Angeles.",2020.0
1049662,39471761,614078475,2020-03-03,163254059,Georgia,Great little place with super easy access from LAX airport via car and uber.  Super clean and loved the amenities,2020.0
1049663,39471761,614294424,2020-03-04,173233238,Rick,Quite a nice place and very convenient especially if you’re just traveling through. The room has everything you’ll need. Highly recommend this Airbnb.,2020.0
1049694,39471761,614922621,2020-03-06,110730284,Greg,Great location with quick access to LAX or to the rest of L.A. Very stylish design with a lot of amenities. Highly recommend for anyone looking for a short or long term stay in the L.A. area.,2020.0
1049695,39471761,615302739,2020-03-07,28011017,Norris,"Clean space, perfect for 2. with everything you need in the area",2020.0
1049696,39471761,616079797,2020-03-08,23713126,Raymond,Great location and amenities. Small kitchen with fridge microwave and (keurig?) machine. Had toiletries with spacious bathroom. Super quiet AC machine with a fireplace. Had a nice big TV although there didn't seem to be any smart functions. Only small complaint was that you can hear cars whizz by and there were a good amount past midnight into the early morning,2020.0
1049697,39471761,617076151,2020-03-11,200412507,Jarvis,"Grant was an amazing host, loved the area, very spacious and clean, will return later in the future.",2020.0
1049698,39471761,617711816,2020-03-13,133152448,Anthony,"Great place. Nice location. And,took less than 11 min from the airport and 40 min from hollywood boulevard",2020.0
1049699,39471761,619208670,2020-03-16,165798027,Stacey,Grant was extremely accommodating and helpful during our stay and the time leading up it.  Especially with all the current news surrounding the recent pandemic crisis.  Grant was open to communication and prompt.  We will definitely be back.,2020.0
1049700,39471761,619920411,2020-03-19,258225314,Alexis,Great place and extremely clean! Better than we expected.,2020.0
1049701,39471761,620119977,2020-03-20,329113097,Kassandra,Great place! Will return :),2020.0
1049702,39471761,620310457,2020-03-21,215501509,Naree,nice place !! recommend,2020.0
1049703,39471761,621067705,2020-03-27,46749213,Christopher,Great place,2020.0
1049704,39471761,621365798,2020-03-30,173880029,Bryanne,great place to stay very clean and grant is great with communication.,2020.0
1049705,39471761,621616248,2020-04-02,136294650,Dustin,Very clean and comfortable check in was very easy parking was right in the drive way the jacuzzi tub was a nice touch I even left a credit card there and he contacted me to tell me he had it for me 5 star all the way!!!!,2020.0
1049706,39471761,621767994,2020-04-04,55351615,Steven,Great place to stay! Clean and spacious for couple!,2020.0
1049707,39471761,621989029,2020-04-07,343255464,Jay,Great stay,2020.0
1049708,39471761,622524737,2020-04-16,231066850,Angel,Great place 👌🏽,2020.0
1049709,39471761,622657174,2020-04-18,342398114,Shaquila,nice place,2020.0
1049732,39471761,622757368,2020-04-19,93642860,Jamine,It’s a great place to stay. It makes you feel like you’re at home.,2020.0
1049733,39471761,622826048,2020-04-20,342398114,Shaquila,Very nice and peaceful,2020.0
1049734,39471761,622872695,2020-04-21,160097668,Prentice,Absolutely amazing place! Love the hot tub!!!,2020.0
1049735,39471761,623313855,2020-04-28,121570817,Jackie,"Really enjoyed my stay! It looks just like the pictures and is super clean and cozy. I loved how quickly Grant responded and even let me check out a bit late. <br/>Thank you for everything, I will be back!",2020.0
1049736,39471761,623811932,2020-05-03,276602473,Sierra,Amazing place felt like home.,2020.0
1049737,39471761,623948595,2020-05-04,212291253,Cierra,Great room,2020.0
1049738,39471761,624034333,2020-05-05,63506311,Larmel,Great stay perfect place,2020.0
1049739,39471761,624106904,2020-05-06,67666861,Jonathan,"Awesome place! Clean, spacious, thoughtful touches, nice area. Would recommend anyone to stay at here!",2020.0
1049740,39471761,624175922,2020-05-07,215501509,Naree,Great place !!!,2020.0
1049741,39471761,624253103,2020-05-08,58472369,Nicole,Great space!,2020.0
1049742,39471761,624332714,2020-05-09,61909337,Sarunas,A cozy and cool spot. Enjoyed it.,2020.0
1049743,39471761,624483150,2020-05-10,8618403,Ahmad,"Great, super clean place. Grant was very responsive with all of my questions",2020.0
1049744,39471761,624624878,2020-05-12,271357898,Danielle,Really spacious. Super nice. I would bring a gaming system or DVD player next time due to no cable or smart functions on tv. However everything else was immaculate!! Beautiful sunset view!,2020.0
1049745,39471761,624694495,2020-05-13,79737408,Maria,Omg Grant Place was everything & so beautiful! The bathtub is amazing also & the location is perfect ! Definitely will be staying again :-),2020.0
1049746,39471761,624871224,2020-05-15,126661090,Jessica,Nice place to stay. Cool bathroom,2020.0
1049747,39471761,625278579,2020-05-18,258273536,Jessie,Place looked really nice and tidy and the restroom was beautiful with a huge tub and walk in shower... and the host was nice to let us in a lil earlier and provided clear instructions and overall a great spot... will definitely come here again,2020.0
1049748,39471761,625342856,2020-05-19,62199854,Misaki,"Very clean, check in process was easy, in a good neighborhood... and the bath tub was a nice added touch! Would highly recommend.",2020.0
1049749,39471761,625630206,2020-05-22,61909337,Sarunas,Always a great stay,2020.0
1049750,39471761,625780565,2020-05-23,128591350,Giovanni,"Nice place, really clean and pretty. <br/>So easy to check in.",2020.0
1049751,39471761,626440804,2020-05-27,344552016,Lashuna,LOOOOVED IT 5 stars,2020.0
1049752,39471761,626700933,2020-05-29,210580448,James,"Awesome place! I usually don’t spend $140 for a 1 night stay but it was worth it!!! Comfy bed, big tv, balcony, HUGE bathroom, private entrance, mini fridge with drinks, work area, fireplace, plus more!!! Literally no problems, 5 STARS!!!",2020.0
1049753,39471761,626832868,2020-05-30,106129506,Sarah,Very nice & clean place! Would highly recommend & return to stay again.,2020.0
1049754,39471761,627378351,2020-06-01,53311750,Jaz,"Safe, quiet, and comfortable. Nothing super super upscale so if you're looking for something grandiose, it may not be your cup of tea (bathroom countertops, carpet etc. are of a 90's/early 00's vibe), however if you want something affordable with super easy parking, away from all the hoorah of LA, this is definitely a great place.",2020.0
1049755,39471761,627486720,2020-06-02,242646625,Andrew,Nice space for short stay,2020.0
1049756,39471761,628329424,2020-06-07,58472369,Nicole,My favorite place to stay in LA!,2020.0
1049757,39471761,628683192,2020-06-09,235903634,Tina,Very nice clean and safe I would stay there again,2020.0
1049758,39471761,628813298,2020-06-10,183944811,Kathy,"Great place to stay, soft bed, big TV, beautiful fireplace, and amazing tub. Didn't meet the host, but they provided me with a wonderful stay, would def book again!",2020.0
1049772,39471761,628952148,2020-06-11,188572270,Ricardo,Grants place is great! I’ll be looking forward to staying there again next time I’m in LA,2020.0
1049817,39471761,629307704,2020-06-13,279432616,Ariel,Very clean and cozy in a great location,2020.0
1049818,39471761,629768798,2020-06-14,349495981,Roger,"This was an amazing place to stay, everything went great!",2020.0
1049819,39471761,629989072,2020-06-15,168019245,Angelina And Matthew,"Only got to stay one night, but it was great. Has pretty much everything you could want, including a gorgeous bathroom, complimentary coffee, a huge TV with a full swivel, and a nice neighborhood",2020.0
1049820,39471761,630101953,2020-06-16,58472369,Nicole,I’ve grown quite comfortable at grants place! Almost like home away from home.,2020.0
1049821,39471761,630259225,2020-06-17,194312345,Kyra,Amazing place! Looks better than the pictures would definitely stay here again.,2020.0
1049822,39471761,630415782,2020-06-18,275907766,OrlandoMagic,"Stylish, great features, and comfortable! Close to the airport!",2020.0
1049823,39471761,630854924,2020-06-20,342107362,Denise,"One of the best stays my partner and I have booked. The place was very clean and was very comfortable. Also, appreciated the complimentary beverages that were provided. Grant was a delightful host. He was very clear in explaining in great detail every step throughout the stay. Definitely a place I’d recommend to anyone and a repeat booking we will sure make in the future.",2020.0
1049830,39471761,631230912,2020-06-21,307919573,Edith,"I had a great stay, it was only for one night but I felt right at home. Will definitely stay again",2020.0
1049831,39471761,631544319,2020-06-22,172181672,Matt,Very accommodating and excellent communication!,2020.0
1049832,39471761,631697922,2020-06-23,351279096,Jose,Five stars !!! <br/>I treat everyone’s place as if it was my own place<br/>Home sweet home. This place was extremely clean beautiful and Price was great<br/>Highly recommend and I will definitely be back,2020.0
1049833,39471761,631862948,2020-06-24,58472369,Nicole,Home away from home!,2020.0
1049834,39471761,632080992,2020-06-25,174291521,Stephanie,House: nice'n'clean.<br/>Location: ultra-convienient.<br/>Host: super-communicative.<br/>Stay: right on.,2020.0
1049907,39471761,633682846,2020-06-30,342398114,Shaquila,Very. Nice and peaceful,2020.0
1049908,39471761,635540376,2020-07-06,55488691,Zach,Amazing place! Very cozy and clean. The hot tub was the perfect touch! Grant even has some extra amenities like coffee and water! Great place! Would totally come back!,2020.0
1049909,39471761,635770174,2020-07-07,298125151,Rasha,Very nice spot! Open layout! Huge bathroom! Only thing that bothered us a bit was the jets in the tub didn’t work. Hopefully they’ll fix it!,2020.0
1049910,39471761,636565095,2020-07-10,348432885,Dom,"Amazing host , great duck off spot",2020.0
1049920,39471761,638230307,2020-07-14,174826542,Huy,I would love to stay again!,2020.0
1049940,39471761,638771456,2020-07-16,261218750,Zachary,Best spot super close super clean and convenient!!!!! Will be booking again,2020.0
1049941,39471761,639128271,2020-07-17,187476056,Mark,"Phenomenal place. Loved how clean it was, and it’s so close to the airport. Loved it. Thank you Grant.",2020.0
1049947,39471761,640166160,2020-07-19,157186189,Savannah,It was all just like the pictures! Such a nice place and amazing bathroom :),2020.0
1049977,39471761,641195687,2020-07-22,259845690,David,Cool place and private.,2020.0
1049999,39471761,641508822,2020-07-23,123370719,Casey,"Grant’s place was great! Nice and spacious. Close to the airport if you are coming from out of town. Very close to the freeway, reserved parking in the driveway which is always nice. The place is very spacious for a couple people.  Very clean and the bathroom is beautiful! Also not to mention the big painting on the wall is a very nice touch to give it an LA feel. <br/>I felt right at home and would definitely stay at Grant’s place again.",2020.0
1050001,39471761,642335335,2020-07-25,192041700,Anica,Private atmosphere great location,2020.0
1050002,39471761,642986285,2020-07-26,78960006,David,Great place to stay very respectful i flew in early before check in time ans grant was very transparent with communication. He got me in early and the place was very clean. I recommend anyone flying into LA or in the area to stay here!,2020.0
1050003,39471761,643421725,2020-07-27,173373346,Chris,Great place to stay! Everything was as described clean and great value check in was easy  👍🏼👍🏼,2020.0
1050004,39471761,644364046,2020-07-30,358486169,Yadira,"Amazing hospitality my stay here was far more than I expected especially after being exhausted from the morning i had, really close to the airport. It had a bathtub that was to die for which was extremely relaxing. The place was very clean and a very private environment. Grant has incredible communication, i was earlier for my check-in and he was an amazing help.",2020.0
1050005,39471761,647065273,2020-08-05,34437254,Jennifer,"Great space, light and airy and super clean. Grant was very quick to respond and very helpful. Everything as described but better in reality.",2020.0
1050006,39471761,647868296,2020-08-07,358748269,Maymuna,"Beautiful, modern, and cleaner than we ever expected! We will definitely book again if we are in the area! 5/5 stars.",2020.0
1050007,39471761,649179671,2020-08-09,224423872,Miguel,It’s a great place. It’s clean. The area is really convenient and the street is not busy. It’s also great to have so many beach options close by.,2020.0
1050008,39471761,649602554,2020-08-10,350759146,Gbenga,Awesome,2020.0
1050009,39471761,652347799,2020-08-16,345467990,Douglas,Grants place is amazing .. will be staying there again soon !,2020.0
1050010,39471761,652869843,2020-08-17,251313002,Sam,Great stay! Unique painting on the wall! Place was clean and trendy!,2020.0
1050011,39471761,653253317,2020-08-18,273831776,Kolby,This exceeded my expectations for sure! Would definitely stay here again.,2020.0
1050012,39471761,653960643,2020-08-20,298151743,Charisse,By far my favorite Airbnb stay!!,2020.0
1050013,39471761,654396963,2020-08-21,233261899,Jordan,"Such an amazing spot, everything you need and more! Would definitely recommend to future guests",2020.0
1050014,39471761,656744299,2020-08-26,362141857,Jennifer,I recommend this place to everyone who needs the place to spend your vacation times. It is a nice and clean guest house.,2020.0
1050015,39471761,657120336,2020-08-27,116578645,Sama,The place was so comfortable I felt right at home the bathroom had so much space the hot water in the shower and bath was so relaxing I love how they remodel the space you can tell they really put their all into this work so beautiful the bed was so comfortable I didn’t even want to get up to check out haha I did get little freak out when I heard tv on but then I realized duh ppl live next door here haha,2020.0
1050016,39471761,657480501,2020-08-28,364291565,John,Love the place!!,2020.0
1050017,39471761,658745282,2020-08-30,293497646,Hannah,"This place was so perfect. The location is very convenient. The bathroom was my favorite part. Very spacious with a large bathtub, separate shower, and two sinks.",2020.0
1050018,39471761,659447629,2020-09-01,284036978,Grace,My boyfriend and I stayed here for two nights along with our cat before flying out of LAX. I really appreciated how quick Grant was to respond to any and all of my questions throughout our stay. We really enjoyed it and definitely recommend!,2020.0
1050019,39471761,659703899,2020-09-02,27978568,Kalilah,Beautifully Clean Place. It feels very private. Would certainly stay here again.,2020.0
1050020,39471761,662177307,2020-09-08,236377671,Arial,Amazing place! The neighborhood was quiet and safe. Very close to the LAX airport. This was so much nicer than the pictures showed. Super clean and great amenities. Will definitely book this place again next time I come to LA!,2020.0
1050021,39471761,664437440,2020-09-14,344857128,Manuela,"One of my favorite Airbnb’s. Definitely exceeded my expectations. Great, stylish, clean, beautiful home. Will be returning.",2020.0
1050022,39471761,664683820,2020-09-15,180077591,Destanie,"This listing is perfect for a couple or one person. I had to drop off my boyfriend at LAX , this listing was less than 10 mins away from LAX and made it so much easier! Place is quite and private. I would recommend. Thanks",2020.0
1050023,39471761,664943801,2020-09-16,363408419,Ariauna,"Comfortable, Clean, & A Peaceful Stay.",2020.0
1050024,39471761,665503544,2020-09-18,103100645,Sharae,"Great area, very clean and efficient",2020.0
1050025,39471761,666904189,2020-09-21,245680317,Claudia,Great place to book for your LA trip,2020.0
1050026,39471761,667830081,2020-09-25,365684407,Joseph,The only thing I was upset with is the jacuzzi jets didn’t work!,2020.0
1050027,39471761,668173798,2020-09-26,367240426,Eva,Overall good and had a good weekend,2020.0
1050028,39471761,669196556,2020-09-28,187128252,Antonio,Great spot will book again.,2020.0
1050029,39471761,669429556,2020-09-29,46323313,David,Very clean and cozy. No complaints!,2020.0
1050030,39471761,670266558,2020-10-02,369304045,Kat,"Amazing place, just as on the pictures, great location!",2020.0
1050031,39471761,670592215,2020-10-03,151815984,Izal,"IT WAS VERY NICE VERY CLEAN AND COMFY DEFINITELY COMING BACK AGAIN EASY GREAT DIRECTION, INFORMATION AND QUITE LOVE IT",2020.0
1050032,39471761,671895757,2020-10-06,107388567,Elzbieta,"Worked perfectly for me.  It is a perfect location for the LAX.  it takes about 9 minutes to drive there and you do not even have to get on the freeway, so no unexpected delays.  The apartment has all it needs.  The parking is by the entrance.  The neighborhood is safe to walk.  Easy access to highway.  If you have a big luggage, please be aware that there are stairs, and you may pack a smaller bag for an overnight and leave your  big bag in the car.",2020.0
1050033,39471761,672418675,2020-10-08,351279096,Jose,"Expect a clean, private , 5 star place. <br/>Grant is awesome!",2020.0
1050034,39471761,673024553,2020-10-10,265306973,Giovanni,"Guest suite was exactly as described in post. Amazing area and hospitality, would definitely recommend another stay!!",2020.0
1050035,39471761,673621952,2020-10-11,129343067,Brandon,"Great place, Grant is very responsive and the place looks gorgeous. Very satisfied with my stay.",2020.0
1050036,39471761,700007013,2020-10-12,354867649,Raychelle,Nice place!,2020.0
1050037,39471761,700455153,2020-10-14,347030894,Terrence,Amazing,2020.0
1050038,39471761,700970694,2020-10-16,8263128,Steffi,Grant was great and this place is perfect for an overnight before or after a flight from LAX.,2020.0
1050039,39471761,702601663,2020-10-21,360071516,Sakiya,Absolutely enjoyed my stay,2020.0
1050040,39471761,702778283,2020-10-22,218520492,Cliffton,"The place was awesome. It was nicer in person than expected. We found it to be very clean, comfortable and private and would most definitely like to stay again next time in town.",2020.0
1050041,39471761,703045267,2020-10-23,159839888,Anthony,"Great neighborhood,  fast location to airport just as stated.",2020.0
1050042,39471761,703365176,2020-10-24,336318794,Fidel,Wouldn’t definitely stay here again ! Great space and very clean ! Would definitely recommend!,2020.0
1050043,39471761,704309937,2020-10-26,350759146,Gbenga,You don’t wanna miss this,2020.0
1050044,39471761,704703458,2020-10-28,229348620,John,Beautiful space for a great price.,2020.0
1050045,39471761,704902805,2020-10-29,350759146,Gbenga,Lovely place to getaway,2020.0
1050046,39471761,706646631,2020-11-04,59401800,Brandon,Grant was super responsive and the apt was well maintained. Loved the bathroom!,2020.0
1050047,39471761,706759191,2020-11-05,263367726,Jessie,"Definitely worth every penny! Amazing, stylish touch and great amenities! Thank you for having us!",2020.0
1050048,39471761,706951304,2020-11-06,368322799,Alex,"This place is awesome. Better than I expected. And had everything you could need in a simple getaway, minus maybe a kitchen . It is way better than dealing with comparable spaces such as a hotel. The balcony is an awesome way to catch a view or a breeze. And the bathroom is so big and has everything you need. I used the suite to set up my computer at the desk and complete work. It was a great stay.",2020.0
1050049,39471761,707245056,2020-11-07,74149568,TaShanna,Great location! So clean and seamless communication! Thanks again!,2020.0
1050050,39471761,707668414,2020-11-08,364990619,Christopher,"Great location, really comfy. Nice and clean amenities. I went to take a test and it was nice and quiet the whole time",2020.0
1050051,39471761,708377352,2020-11-12,263779048,Christian,"great place to get away and relax, this place is very spacious and the bathroom was very large and relaxing. It really is private and quiet so it was fantastic to get a deep sleep in finally. Would definitely recommend and stay here again !",2020.0
1050052,39471761,709500368,2020-11-16,210738083,Jennie,Our stay at Grant place was really nice. Ita truely a nice place. Bathrroom spooking or,2020.0
1050053,39471761,709634876,2020-11-17,347744274,Natalie,Great stay. Definitely exceeded my expectations.,2020.0
1050054,39471761,709762571,2020-11-18,164878157,Paul,"The studio exceeded our expectations. My Gf was able to enjoy the Coffee amenities. Very comfortable, cozy & quiet. Love how the TV is mounted right in front of the bed. Huge bathroom. We had a very relaxing night. We wish we booked for longer. Only thing is TV was terribly slow but otherwise it still functions properly.",2020.0
1050055,39471761,710783853,2020-11-22,131369034,Tia,"Such a beautiful place, I had the best time. Grant even let me check in a little early. The TV was perfectly placed. It was a little noisy sometimes but other than that it was awesome. And he was very responsive!",2020.0
1050056,39471761,711479577,2020-11-26,356985663,Jayanna,"Grants place was just as pictured. Nice , clean and quiet will definitely book again. I didn’t have any problems during my stay.",2020.0
1050057,39471761,711960910,2020-11-28,71035518,Frances,Cool place,2020.0
1050059,39471761,712902663,2020-12-01,377285753,Kristin,Great location. Great host. Great space. Easy get away. Thank you!,2020.0
1050060,39471761,713031239,2020-12-02,204462414,Melanie,"Great airbnb! Very nice host, easy check in and close to the airport",2020.0
1050061,39471761,713921172,2020-12-06,324629670,Zoe,Cute private studio-type apartment. Only 5 mins from LAX !,2020.0
1050062,39471761,714440512,2020-12-09,103167331,Kimberly,"Please note, there are stairs to walk up to the studio. The place is just as described. It was cozy and comfortable. Not sure if the person before me or the neighboring studio is a smoker. The studio had a smell of smoke. Other than that, I enjoyed my stay. Close to LAX.",2020.0
