,listing_id,id,date,reviewer_id,reviewer_name,comments,Year
728774,22215734,219125972,2017-12-16,108263311,Nick,"Isaac responds quick, is very helpful, and the space was super comfortable and clean. 5⭐️⭐️⭐️⭐️⭐️  the guest suite is better than the pictures! Everything is brand new, a lot of closet space, there's even a mini fridge and a coffee maker with Togo coffee cups so when you check out you have a cup of coffee to take with you. Best air bnb I've stayed at !",2017.0
728789,22215734,219534213,2017-12-17,45640106,Terrence,Host was very nice and very thoughtful to what we needed for our stay. Will definitely be staying here for my next visit! He made us feel very comfortable,2017.0
728790,22215734,220091399,2017-12-20,153561923,Liliana,"This place is amazing ! Super clean, modern , and private . Great amenities in the studio and HUGE closet , wish we would've stayed longer to take advantage of the closet space ! Definitely 10/10 .",2017.0
728791,22215734,220530791,2017-12-22,141450318,Lauren,"Great space to stay in. It is probably just for two people but it is very comfortable. Great back patio entrance, very private. Heater in the room warms the room up immediately, feels so cozy. Recently remodel. Stylish and very clean! Bathroom is big and shower is wonderful. Also loved the complimentary water in the fridge and coffee maker. Closet and TV are huge. Great place to stay in LA.",2017.0
728792,22215734,220755306,2017-12-23,120301739,April,"This cute one bed, one bath is located in the back of the main house and has its own private entrance and gate entrance. Which allows you to not disturb the owner. The place was clean and had a TV, ample bathroom and enough space for 2. Issac was great and was quick with responding. Enjoyed this place and would definitely stay there again.",2017.0
728793,22215734,220989018,2017-12-24,163762142,Omar,"Totally worth a stay, photos give this place no justice. Very easy and convenient, with modern housing.",2017.0
728800,22215734,221179989,2017-12-25,162923738,Yesenia,"The suite was clean,  beautiful and perfect for my husband and I. I look forward too staying here when I find myself in L.A. again.  Thank you Isaac.",2017.0
728801,22215734,222827079,2017-12-30,17085335,Alyssa,Great place! Definitely recommend for those trying to stay near LAX.,2017.0
728802,22215734,223808532,2018-01-01,82719439,Samyouel,Nice little cozy place. Very clean and nice amenities. Easy to find and host is very responsive and answers any inquiries in a professional and timely manner. If im ever in the area ill probably stay here again!,2018.0
728803,22215734,224299983,2018-01-02,164553477,Garrett,A+,2018.0
728804,22215734,225233527,2018-01-05,91515018,Varshini,Isaac was a great host!  The place was very clean and accessible to various parts of LA.  Thanks for a great time!,2018.0
728805,22215734,225500609,2018-01-06,6602645,Luis,"Issac's place was perfect for our one-night-stay in LA. The house is in a cul-de-sac literally minutes away  from LAX and offers all the privacy and comfort of a hotel room. The checking and checkout was super easy, the bed was comfy, and the TV was HUGE. Many good restaurants are nearby and we had a quick Uber ride to the Santa Monica pier. Issac went above and beyond for us by having a small space for us to leave our luggage while we explored the city before our flight. Thanks for everything Issac!",2018.0
728806,22215734,225842689,2018-01-07,164979218,Jesus,"The location of the Airbnb was great and really close to the airport. Isaac was a great and responsive host. The Airbnb itself was clean, stylish and super comfortable. Would definitely stay again if i come back to the area!",2018.0
728807,22215734,226099798,2018-01-08,3148383,Ashley,Isaac’s place is exactly how it is described. The location is perfect for anyone that needs to be at the airport the following day. I would stay here again. Thank you again Issac for the clear directions on checking in.,2018.0
728808,22215734,226457771,2018-01-10,166077073,Michael,They had coffee which I did not expect and it was much more private then it seems from first view.,2018.0
728809,22215734,226627531,2018-01-11,131070188,Tanisha,"Two words, absolutely gorgeous! Hands down the best place to stay for a single person or couple.. very quiet and comfortable. Beyond clean. He also responds very quickly! Would love to stay there again! ☺️",2018.0
728810,22215734,228422653,2018-01-19,4942261,Chivonne,"Issac's home was beautiful, very clean and spacious. Host was amazing and responded very fast.",2018.0
728811,22215734,229039455,2018-01-21,42138671,Brian,"Isaac's home was very comfortable and a short drive from LAX. His communication was great, and he made it very easy to check in and check out. Great host!",2018.0
728812,22215734,229301625,2018-01-22,158232867,Naloni,"The guest home is very clean, stylish and roomy. The responses to any questions I had were quick and overall it was a great experience.",2018.0
728813,22215734,230026601,2018-01-26,4598275,Anh,"Amazing stay for our overnight stopover. So convenient to get to LAX - clean, comfy, and cozy. Easy checkin and instructions were very clear. Street parking was not an issue. Thanks again! Highly recommend.",2018.0
728825,22215734,230715835,2018-01-28,43541381,Michelle,Isaac’s apartment was great.  Very clean and had everything we needed.  The location was great!  Will definitely stay there again!,2018.0
728826,22215734,230942373,2018-01-29,134711689,Priya,"Isaac's place was clean, comfortable and spacious. He gave precise directions and made the check in process easy. The location is conveniently located close to the airport.",2018.0
728840,22215734,231136494,2018-01-30,152379882,Cassie,Beautiful suite that has everything you need. Even better than the pictures! Isaac was very quick with responding and very hospitable! Would definitely stay again.,2018.0
728859,22215734,231340244,2018-01-31,145388558,Deb,"Everything about the suite was great. It was clean, smelled good, and relaxing.",2018.0
728860,22215734,231775275,2018-02-02,38409964,Paul,Great place. Would stay again,2018.0
728861,22215734,231994738,2018-02-03,33537956,Bry,great location and great hospitality :),2018.0
728862,22215734,232432795,2018-02-04,146868006,Emily,"Isaacs place was located right near the airport, great for people needing to fly out after they check out! The place was very spacious and provided coffee, which was great! Isaac communicated very quickly! Would definitely stay again :)",2018.0
728863,22215734,233048363,2018-02-07,37336692,John,"Perfect way to end your trip to L.A., especially if you have an early flight like I did. Minutes from LAX, you're sure to be able to sleep a bit longer and not worry about having to beat traffic or missing flights. The place is in a residential area, but neat because it's tucked away towards the back of the home. Very clean, hotel like, nice and private room. Issac was very helpful, he even let me borrow a phone charging cable so that I may charge my phone as I had lost mine earlier that day. <br/>Highly recommend this one.",2018.0
728864,22215734,233461060,2018-02-09,106338152,Cara,Perfect spot for location to LAX in a quite neighborhood. Walking distance to shops and a short Über ride to the airport.,2018.0
728865,22215734,233720801,2018-02-10,124385024,Matt,"Stayed here one night after a long flight, great place to stay.",2018.0
728866,22215734,234453982,2018-02-12,166663493,Chelsea,"I loved that this room was 5 minutes to the airport - it made our stay much less stressful knowing we wouldn't have to fight traffic to LAX. The room itself was very comfortable and clean, with a nice private entrance.",2018.0
728867,22215734,234928440,2018-02-14,173124043,Glendelynn,"Booked this guest suite the night before I flew out to LAX. Rented a car at enterprise and was literally a 5 min drive from the LAX location. Excellent communicator, clear instructions, cleanliness of the guest home was the best. Everything from amazon prime and Netflix, beverages including coffee and tea were provided and the shower was really nice. Would definitely come back and stay here again.",2018.0
728868,22215734,235183029,2018-02-15,133989194,Ramon,"Excellent stay, so much that we booked another night on our way back from Mexico.",2018.0
728869,22215734,235444793,2018-02-16,167287282,Tyron,The place was amazing and comfortable,2018.0
728870,22215734,235708125,2018-02-17,35641118,Dulce,"This place is amazing! My husband, baby, and I spent a night here because we had a long layover in LA and we couldn't have been more pleased. Isaac was great at communicating and gave us perfect directions to get in. The amennitites were an extra plus we were not expecting, specially having hot water available for baby's formula! We loved staying there.",2018.0
728871,22215734,236888017,2018-02-20,108086864,Ian,"Nice secluded location. Easily accessible from LAX. Clean, thoughtfully decorated, and spacious enough for a comfortable stay for two.",2018.0
728872,22215734,237128239,2018-02-21,311715,Christa + David,"After a 10 hour travel day, this place was just what we needed. Great space, comfortable, quiet neighborhood, and close to the airport!",2018.0
728873,22215734,237942205,2018-02-24,161202351,Lexie,This was just perfect for our overnight stay before our cruise!  The room was lovely and the bed was divine!!  We would definitely stay here again!!,2018.0
728874,22215734,238446777,2018-02-25,170208284,Loni,"Great, clean space. We were very pleased. Thank you, Isaac!!",2018.0
728875,22215734,238749084,2018-02-26,773676,Heather,"Great apartment in LA! The location to the airport makes this a super convenient spot for a layover or even longer stay in LA. The space was modern, clean, and super cute! We especially loved the little touches like coffee and fridge left for us. Made the morning super easy. Isaac was very nice and quick to respond. We would definitely stay here again and would recommend to our friends!",2018.0
728876,22215734,238969452,2018-02-27,22923510,Olu,Cozy little spot that is extremely close to the airport. Quiet and comfortable space. Everything was set up well from check in to the accommodations.,2018.0
728877,22215734,239427424,2018-03-01,101564632,Andrew,Convenient spot for lax travel!,2018.0
728878,22215734,239676820,2018-03-02,33642314,Jackie,Very conveniently located near the airport! Great communication and easily accessible. Very clean and well thought out accommodations! Highly recommended. ,2018.0
728879,22215734,239933412,2018-03-03,161286307,Yuguo,Well decorated house. Very clean and comfortable. Highly recommended,2018.0
728883,22215734,240916260,2018-03-06,3313900,Anais,"The place was clean, quiet and we loved that our host provided coffee et water.<br/>Communication was proactive and prompt",2018.0
728895,22215734,241129215,2018-03-07,49268094,Hitesh,"This is a fantastic space! Isaac takes really good care of the guest room. The place was really clean and with good amenities. Honestly, I can suggest hotels to emulate that kind of care for a space. Check-in was easy and quick. Highly recommended!",2018.0
728896,22215734,241334459,2018-03-08,124204322,Dorian,Place was super close to airport and rental car places and in a nice neighborhood.. the room is super super nice and luxurious. Nice room and closet space . Big bed . Huge tv. A lot of power outlines by bed to charge your devices . Nice shower and style . Super nice place .,2018.0
728908,22215734,241574335,2018-03-09,171346853,Alexies,Super close to LAX airport but you can’t hear any airplanes overhead at all. Really clean modern space with all the essential amenities. Would stay again.,2018.0
728949,22215734,242394524,2018-03-11,194261,LuRae,"Isaac is an amazing host. The space is beautiful, spotless, so modern, with all the right touches. His communication was so helpful, he proactively gave me everything I needed to find the unit and get inside.<br/>Bedding is so comfortable and the space is so cozy. Highly recommend staying here. I will again for sure.",2018.0
728950,22215734,242677440,2018-03-12,166484088,Amber,Issac was very prompt when we had an issue with the tv. He gave us excellent suggestions for places to eat and drink. Thanks so much!,2018.0
728961,22215734,242910511,2018-03-13,10923091,Kervin,The place is literally quite perfect. Has all the amenities you could want. We could have easily stayed there for weeks!,2018.0
728962,22215734,243124280,2018-03-14,9770518,Vinny,Perfect for us as a close stay to the airport. Couldn't have been more convenient,2018.0
728963,22215734,243372095,2018-03-15,126447069,Mark,Isaac's place is very nice and clean. It was close to the airport and exactly what we needed for our early am flight. Very responsive and considerate host! Highly recommend.,2018.0
728977,22215734,243676008,2018-03-16,11562512,Lara,"This place is terrific!  If you have a chance to stay here, grab it: It is spanking clean, stylish, serene, very private--simply lovely! <br/>Issac is a great host as he responds immediately to questions and he is very friendly. I would love to stay here again !! <br/>Thank you, Issac!!",2018.0
728978,22215734,243969790,2018-03-17,14766647,Allison,"Great communication and easy self check in and check out. The space was spotlessly clean, and we had everything we needed for our last night in LA before a very early flight home. It took 6 min. to drive to the car rental return, making it a convenient and much more comfortable option than the hotels in the area. We’ll definitely try staying here again when we’re flying out of LA.",2018.0
728979,22215734,244551421,2018-03-18,163244658,Rachel,Extremely accurate to what was shown and an amazing experience for me and  my boyfriends first time trying an air bnb. We will definitely be back .,2018.0
728980,22215734,244841887,2018-03-19,95476599,Jalen,Very clean and convenient space!,2018.0
728986,22215734,245087777,2018-03-20,57957505,Karra,"Isaacs studio was perfect for what we needed! We had a huge day travelling and it was just 5min from the car rental pick up spot.. super convenient and extremely easy to check in with the door codes! Isaac was helpful with communication in the lead up and during the stay- super quick at responding. The bed and pillows were really comfy, and the place in general was really cozy and refreshing. I would definitely stay again!!",2018.0
728987,22215734,245294900,2018-03-21,1718187,Stephen,"I only stayed at Isaac’s for one night on a quick layover, but it was clean and exactly as described. Loved the shower and the large TV, and incredibly close to LAX. Will stay again on my next layover.",2018.0
728999,22215734,245820302,2018-03-23,50537293,Frank,Very clean and modern looking. Perfect for a short stay. Very quiet and in sort of a secluded neighborhood.,2018.0
729000,22215734,246656688,2018-03-25,60116280,Stan,The space is amazingly clean and quiet and the closeness to LAX is great. Isaac gave detailed check-in directions and when we arrived at 1 in the morning we had no problem finding our place and getting settled. Highly recommended,2018.0
729001,22215734,246933006,2018-03-26,6015828,Babz,"Isaac’s place was ideal for us flying in from Mexico, staying a night at Isaac’s place and flying out the next morning to SFO.  The room was esthetically pleasing and clean with a very modern decor, comfortable bed and privacy.",2018.0
729002,22215734,247241695,2018-03-27,93148504,Tawni,"This place is super close to the airport, very modernized and spacious. Instructions to get inside were extremely descriptive which I appreciated. (#airbnbadventures) Very clean, small touches that made it homey, large tv,  and Isaac the host was quick to respond and very helpful. I loved the neighborhood too.",2018.0
729015,22215734,247505640,2018-03-28,99436171,Kierstin,Issac is quick to communicate and his place is spotless. It was a $10 ride to the airport early in the morning and he made check in and check out a breeze.,2018.0
729016,22215734,247765143,2018-03-29,60116280,Stan,Isaac has a great place to stay. If you're coming or going through LAX it is perfect. It has nice touches in a very comfortable space. When we are back in LA we will definitely stay there. Isaac is an excellent host.,2018.0
729017,22215734,248152613,2018-03-30,175922320,怜,very clean and nice room.,2018.0
729018,22215734,248549082,2018-03-31,77943944,Krzysztof,"Apartment is very clean and cozy. Great localization, close to airport and Venice Beach. Easy and comfortable check in. Perfect communication with Issac. Highly recommend!",2018.0
729019,22215734,249175157,2018-04-01,174978540,Sophia,Very comfortable and stylish room with private entrance and easy check in!,2018.0
729020,22215734,249762225,2018-04-02,17553244,Christian,Great host and great stay!,2018.0
729021,22215734,250072767,2018-04-03,40747820,Maia,Great helpful host.  Very easy communication.  A perfect place for a quick stay.,2018.0
729022,22215734,250345047,2018-04-04,104301521,Paola,"Great place! I traveled with my son, I felt very safe and supported by our host, he always attended to all my questions and the place is really pretty and clean. I Only stayed one night but we would like to stay there more days. I definitely will come back some day.<br/>Muchas gracias Isaac!",2018.0
729023,22215734,250959163,2018-04-06,93257918,Scott,Very clean and everything I required for a night stay before flying out. Perfect location to LAX.<br/>Would recommend highly.,2018.0
729024,22215734,251334661,2018-04-07,716038,Gabrielle,"Isaac's place is FANTASTIC! Isaac responds quickly to messages. His place is easy to access and he greeted us when we arrived, offering some tips on where to have dinner that evening. His place is super close to the airport which made dropping off our rental car very easy. On top of all that, the space is in a quiet spot, beautifully decorated and sparkling clean. You will love it!",2018.0
729025,22215734,252679769,2018-04-11,180924125,Gabrielle,Safe neighborhood right next to the airport! Very secluded private area of your own.,2018.0
729026,22215734,252950947,2018-04-12,5452594,Lori,Very tidy and exactly as pictured online. Coffee and tea and sparkling water were available - nice to have when you’re too tired to go anywhere! The bed was extremely comfy and the shower was nice. Great value so near to LAX!,2018.0
729027,22215734,253229839,2018-04-13,62704056,Joseph,"Very easy to check-in, no hassle at all. Quiet neighborhood, close to the airport. The room was amazing, extremely clean and private. I would strongly recommend this place and would definitely stay again if I’m in the area.",2018.0
729028,22215734,254468376,2018-04-16,140816603,Rebecca,"This was a great place to stay! Super close to rental car and airport, very clean, felt like home!  We would definitely stay here again.",2018.0
729029,22215734,254946645,2018-04-18,17458303,Nancy,"We were looking for a spot close to LAX, given our 6 AM departure time and need to be at the airport at 4:00 AM. Isaac's place is perfect for this. Comfortable bed, 5-10 minutes from airport on side streets, nice large TV. nice bathroom. he also provided some small amenities like water and soda that made a difference too. Thank you Isaac!",2018.0
729049,22215734,255202766,2018-04-19,3250827,Surba,Great location. Simple check-in process. Awesome value. Glad I chose Isaac’s place.,2018.0
729050,22215734,255493413,2018-04-20,8838082,John,"A great space for a couple or just a single traveler. The bathroom was beautiful, the bed was great, fell asleep as soon as I laid down. You can't beat the location because it is right there by LAX. It's a great feeling knowing you don't have to deal with LA traffic on the way to LAX traffic. I would definitely recommend staying here, if I don't grab it first.",2018.0
729051,22215734,256389979,2018-04-22,123527005,Christina,"Great space close to LAX! We were here on a layover, wish we could have stayed longer.",2018.0
729052,22215734,256829177,2018-04-23,256864,Seung,"This place is better than 4 start hotel for sure and so clean!!! This was the cleanest place that I stayed in Airbnb for sure!!! If you want clean and quiet, this is the place...",2018.0
729053,22215734,257054612,2018-04-24,84866614,Jayne,Isaac’s place is exactly what you need after a big weekend of traveling before a flight. It’s location and homeliness made it the ideal spot for a pre or post flight. Check in was super easy and Isaac provided a wealth of information and instruction to make it all that much easier. Would recommend and definitely would stay again,2018.0
729054,22215734,257329335,2018-04-25,74518769,Caitlin,"Great place to stay!! Really cute unit, great for a short stay or 1 night like us. Very close to the airport so perfect for a short layover. Unit was really clean, and very cosy we enjoyed our stay a lot!!",2018.0
729055,22215734,257884145,2018-04-27,5522143,Michael,"Highly recommend, super close to the airport, very nice, comes as advertised!",2018.0
729072,22215734,258213948,2018-04-28,5434439,Kathy,"This place is amazing. Spotlessly clean, great amenities--coffee maker, fridge, iron, great hair dyer, water and seltzer water in fridge, huge television, comfortable bed...I could go on and on.  We only stayed one night due to the close proximity to the airport, but would have stayed much longer if needed. Check in was a breeze (we arrived late, but only needed a code to get in) and check out time was perfect for our flight. I would definitely stay here again!! Amazing price for LA.",2018.0
729073,22215734,258783337,2018-04-29,55420779,Evelyn,Everything was perfect. Very happy with the extra amenities. Thank you!,2018.0
729074,22215734,259804472,2018-05-02,72734827,Patty,"Thanks for a lovely stay! Issac was kind enough to let us leave our luggage there before check in. The space was beautiful and comfortable, and a quick drive from the airport. Exactly what we were looking for!",2018.0
729075,22215734,260131664,2018-05-03,671633,Erin,"The place is perfect, really enjoyed our stay, the coffee machine is a treat. Thanks!",2018.0
729076,22215734,260382542,2018-05-04,178829877,Matthew,Isaac is a great host who responds quickly to messages. His place is clean and exactly as described. It's perfect for those wanting to be close to LAX for early flights.,2018.0
729077,22215734,260700352,2018-05-04,29951775,Myron,"Isaac’s place was clean and he communicated very well, would highly recommend staying here.",2018.0
729078,22215734,261048468,2018-05-05,178548609,Regielyn,"Isaac’s place was AWESOME! My boyfriend and I stayed for one night to explore Venice Beach and Santa Monica. The TV and artwork was really nice. It was very thoughtful to have a mini fridge with drinks, coffee maker and other eating utensils. We loved the finishing touches of the bonsai plants and the adjustable lamps by the bedside, highly recommend.  We would definitely stay here again.",2018.0
729079,22215734,261593054,2018-05-06,33149559,Camille,"So close to the airport and very well equipped with drawer/closet space, toiletries, etc! Easy and convenient check in routine that required no interaction — would stay again definitely!",2018.0
729080,22215734,262088535,2018-05-07,99773083,Henrique,"Isaac, thank you for everything, the bedroom was very cozy, comfortable and clean. No doubt this was the best bedroom we stayed during our honeymoon trip around California. I wish I stayed more days in your unit. Congrats for all attention and care, like having available bottles of water, coffee maker, soap, shampoo etc... room is very spacious, and recently renovated.<br/>5 stars!!",2018.0
729081,22215734,262423867,2018-05-08,110897980,Lucy,"We had a lovely one night stay at Isaac's before catching our flight. Everything was perfect, especially the comfortable bed, fab bathroom and all the little extras that made our stay extra special. Thank you!",2018.0
729082,22215734,262695103,2018-05-09,110596538,Robert,"Isaac was a great host and provide the accommodation we required for one night. Close to LAX, clean ,comfortable and  secure. He was kind enough to allow us to leave luggage there after checkout and collect  later on our way to airport.<br/>I would use again.<br/>Many thanks",2018.0
729083,22215734,263685045,2018-05-12,110353664,Monika,Awesome and cozy,2018.0
729084,22215734,264384704,2018-05-13,66063536,Kyle,"A perfect place that is conveniently located nearby to LAX! Great communication with easy to understand instructions. The space itself was perfect - clean, practical, and comfortable.",2018.0
729095,22215734,265334057,2018-05-16,115533270,Max,Super frindly host. Best location if you wanna catch a flight( with rentel car places und lax in 8min reach).<br/>The room was clean and fresh. <br/>Would fully recomend the room,2018.0
729096,22215734,265928804,2018-05-18,137289426,Hannes,"This is a clean, safe and secluded space. Although close to LAX the airport noice was not audible.",2018.0
729097,22215734,266258490,2018-05-19,110476338,Jane,"As it happened I had sprained my ankle a day before arriving at Isaac’s place. His place was just perfect as I spent a day or so staying off my feet and keeping my ankle elevated. The space is compact but well equipped and everything I needed was in easy reach, and there was a spacious and extremely clean bathroom. I liked feeling secure with the locked gate and door. Isaac responded with lightning speed when we had trouble with the TV (it just needed a reset). WiFi was great. Leaving, my trip to LAX was just 10 minutes. Thank you to Isaac.",2018.0
729098,22215734,266858391,2018-05-20,57264239,Alicia,Perfect for my late night arrival into LAX. Super clean and stylish. On my list to return.,2018.0
729099,22215734,267495081,2018-05-21,105833993,Joe,Spacious room. Great decor. Super cozy. Easy and straight forward instructions.,2018.0
